{
  "schemaVersion": 1,
  "derived": true,
  "authority": {
    "stableEvidence": "apps/dsh-desktop/runtime-support/known-good.json",
    "source": "apps/dsh-desktop/runtime-support/supported-runtimes.source.json",
    "packageManifest": "apps/dsh-desktop/package.json",
    "lockfile": "pnpm-lock.yaml"
  },
  "entries": [
    {
      "status": "supported",
      "upstreamVersion": "0.2.1-rc.4",
      "providerId": "dsh-cli-provider-v1",
      "desktopRange": "=5.2.0",
      "capabilities": [
        {
          "id": "host-service.register",
          "status": "unsupported"
        },
        {
          "id": "profile.paths",
          "status": "available"
        },
        {
          "id": "runtime.lifecycle",
          "status": "available"
        },
        {
          "id": "runtime.observe",
          "status": "available"
        },
        {
          "id": "session.create",
          "status": "unsupported"
        },
        {
          "id": "session.observe",
          "status": "unsupported"
        },
        {
          "id": "support.evidence",
          "status": "available"
        },
        {
          "id": "transport.fetch",
          "status": "available"
        },
        {
          "id": "transport.stream",
          "status": "available"
        },
        {
          "id": "workspace.register",
          "status": "unsupported"
        }
      ],
      "verifiedAt": "2026-10-27",
      "matrixArtifact": "docs/archive/2026-10-27-desktop-5.2.0-prediction-guide.md",
      "knownIssues": [
        "Clean-account Setup installation, overlay upgrade and rollback are not certified by isolated executable acceptance.",
        "Final repository and packaged acceptance receipts are tracked separately from these installed-input identities.",
        "Local Windows Runtime/SDK compatibility evidence only; macOS and Linux require separate native acceptance.",
        "The companion-default snapshot passed Windows source-core 30/30; the subsequent presentation-only Tab guide passed its own 13 native checks and 880x640 geometry acceptance. The full source-core gate was not repeated for the guide; no rebuilt installer is certified.",
        "The prior local 5.2.0 installer has its own historical packaged acceptance; it predates these companion-default changes. No installer was rebuilt for the current source inputs."
      ],
      "evidence": {
        "package": {
          "name": "@deepseek-ai/dsh",
          "version": "0.2.1-rc.4",
          "integrity": "sha512-8gxl6zOi6vx1sDolH+vjh9txrpbXD+t74Z2YfWkEBtR3xP2YEtk0bbLkgLZRnYQgDxCoXitXyXDKn5k0+6iXrg==",
          "files": {
            "package.json": "ab0994ef7fc70a9974d39735d6e30b500b4be3435012b53cab1df149f39bbc5c",
            "lib/bin.js": "80112efe368efb1a39720c7ada0af00442e5131fb2744edaaff8a3e8bb499e6f"
          }
        },
        "peers": {},
        "lockfile": {
          "path": "pnpm-lock.yaml",
          "sha256": "2b326cd9798423b610ae25dcf1972e57f9d3b8a07d4e22fd3d409ab8b3e26e2a"
        },
        "slots": [
          "conversation.composer.dock",
          "conversation.input.dock",
          "conversation.input.left",
          "conversation.input.model",
          "conversation.input.selector.context",
          "conversation.session.header.actions",
          "root",
          "settings.models.footer",
          "settings.section",
          "sidebar.footer.action",
          "sidebar.remote",
          "sidebar.right.pane.tab",
          "tool.call.toolview",
          "web-ui.plugin.item"
        ],
        "patches": {
          "registry": "packages/dsh-desktop-compat/src/patch-registry.ts",
          "sha256": "7fd3b66cce08746f723e3541e6b7e8ee14702afad32aa5376f4f5d49520dcb26",
          "ids": [
            "cancellation-presentation",
            "cold-blank-session-checkpoint",
            "desktop-skin-profile-isolation",
            "live-session-title-checkpoint",
            "queued-turn-continuation",
            "session-startup-corruption",
            "tool-call-arguments-envelope",
            "tools-capability-request-side",
            "transcript-tool-call-balance"
          ]
        },
        "packagedRuntime": {
          "packageRoot": "resources/app.asar.unpacked/node_modules/@deepseek-ai/dsh",
          "cli": "resources/app.asar.unpacked/node_modules/@deepseek-ai/dsh/lib/bin.js",
          "profileName": "desktop",
          "executionMode": "electron-run-as-node",
          "requiredFiles": [
            "lib/bin.js",
            "package.json"
          ]
        }
      }
    }
  ]
}
